{
  "$schema": "https://json-schema.org/draft-07/schema",
  "version": "1.0.0",
  "generated": "2025-02-10",
  "description": "URL redirect mappings for documentation portal restructure",
  "metadata": {
    "project": "NewsCatcher API Documentation",
    "change": "Remove the v3 prefix and introduce a new structure: Home | Web Search API | News API | Local News API. Flatten API reference docs and use a consistent pattern for other documentation types.",
    "total_redirects": 105
  },
  "redirects": [
    {
      "source": "/docs/v3/catch-all/overview/introduction",
      "destination": "/docs/web-search-api/get-started/introduction",
      "type": "permanent",
      "status_code": 301
    },
    {
      "source": "/docs/v3/catch-all/overview/quickstart",
      "destination": "/docs/web-search-api/get-started/quickstart",
      "type": "permanent",
      "status_code": 301
    },
    {
      "source": "/docs/v3/catch-all/overview/monitors",
      "destination": "/docs/web-search-api/concepts/monitors",
      "type": "permanent",
      "status_code": 301
    },
    {
      "source": "/docs/v3/catch-all/overview/dynamic-schemas",
      "destination": "/docs/web-search-api/concepts/dynamic-schemas",
      "type": "permanent",
      "status_code": 301
    },
    {
      "source": "/docs/v3/catch-all/overview/understanding-dynamic-schemas",
      "destination": "/docs/web-search-api/concepts/dynamic-schemas",
      "type": "permanent",
      "status_code": 301
    },
    {
      "source": "/docs/v3/catch-all/overview/changelog",
      "destination": "/docs/web-search-api/get-started/changelog",
      "type": "permanent",
      "status_code": 301
    },
    {
      "source": "/docs/v3/catch-all/how-to/write-effective-queries",
      "destination": "/docs/web-search-api/how-to/write-effective-queries",
      "type": "permanent",
      "status_code": 301
    },
    {
      "source": "/docs/v3/catch-all/how-to/configure-monitors",
      "destination": "/docs/web-search-api/how-to/configure-monitors",
      "type": "permanent",
      "status_code": 301
    },
    {
      "source": "/docs/v3/catch-all/how-to/troubleshoot-monitors",
      "destination": "/docs/web-search-api/how-to/troubleshoot-monitors",
      "type": "permanent",
      "status_code": 301
    },
    {
      "source": "/docs/v3/catch-all/endpoints/initialize-job",
      "destination": "/docs/web-search-api/api-reference/jobs/initialize-job",
      "type": "permanent",
      "status_code": 301
    },
    {
      "source": "/docs/v3/catch-all/endpoints/create-job",
      "destination": "/docs/web-search-api/api-reference/jobs/create-job",
      "type": "permanent",
      "status_code": 301
    },
    {
      "source": "/docs/v3/catch-all/endpoints/continue-job",
      "destination": "/docs/web-search-api/api-reference/jobs/continue-job",
      "type": "permanent",
      "status_code": 301
    },
    {
      "source": "/docs/v3/catch-all/endpoints/list-user-jobs",
      "destination": "/docs/web-search-api/api-reference/jobs/list-user-jobs",
      "type": "permanent",
      "status_code": 301
    },
    {
      "source": "/docs/v3/catch-all/endpoints/get-job-status",
      "destination": "/docs/web-search-api/api-reference/jobs/get-job-status",
      "type": "permanent",
      "status_code": 301
    },
    {
      "source": "/docs/v3/catch-all/endpoints/get-job-results",
      "destination": "/docs/web-search-api/api-reference/jobs/get-job-results",
      "type": "permanent",
      "status_code": 301
    },
    {
      "source": "/docs/v3/catch-all/endpoints/create-monitor",
      "destination": "/docs/web-search-api/api-reference/monitors/create-monitor",
      "type": "permanent",
      "status_code": 301
    },
    {
      "source": "/docs/v3/catch-all/endpoints/update-monitor",
      "destination": "/docs/web-search-api/api-reference/monitors/update-monitor",
      "type": "permanent",
      "status_code": 301
    },
    {
      "source": "/docs/v3/catch-all/endpoints/list-monitors",
      "destination": "/docs/web-search-api/api-reference/monitors/list-monitors",
      "type": "permanent",
      "status_code": 301
    },
    {
      "source": "/docs/v3/catch-all/endpoints/list-monitor-jobs",
      "destination": "/docs/web-search-api/api-reference/monitors/list-monitor-jobs",
      "type": "permanent",
      "status_code": 301
    },
    {
      "source": "/docs/v3/catch-all/endpoints/get-monitor-results",
      "destination": "/docs/web-search-api/api-reference/monitors/get-monitor-results",
      "type": "permanent",
      "status_code": 301
    },
    {
      "source": "/docs/v3/catch-all/endpoints/enable-monitor",
      "destination": "/docs/web-search-api/api-reference/monitors/enable-monitor",
      "type": "permanent",
      "status_code": 301
    },
    {
      "source": "/docs/v3/catch-all/endpoints/disable-monitor",
      "destination": "/docs/web-search-api/api-reference/monitors/disable-monitor",
      "type": "permanent",
      "status_code": 301
    },
    {
      "source": "/docs/v3/catch-all/endpoints/webhook-payload",
      "destination": "/docs/web-search-api/api-reference/monitors/webhook-payload",
      "type": "permanent",
      "status_code": 301
    },
    {
      "source": "/docs/v3/catch-all/endpoints/health",
      "destination": "/docs/web-search-api/api-reference/meta/health",
      "type": "permanent",
      "status_code": 301
    },
    {
      "source": "/docs/v3/catch-all/endpoints/version",
      "destination": "/docs/web-search-api/api-reference/meta/version",
      "type": "permanent",
      "status_code": 301
    },
    {
      "source": "/docs/v3/catch-all/libraries/python",
      "destination": "/docs/web-search-api/libraries/python",
      "type": "permanent",
      "status_code": 301
    },
    {
      "source": "/docs/v3/catch-all/libraries/typescript",
      "destination": "/docs/web-search-api/libraries/typescript",
      "type": "permanent",
      "status_code": 301
    },
    {
      "source": "/docs/v3/catch-all/libraries/java",
      "destination": "/docs/web-search-api/libraries/java",
      "type": "permanent",
      "status_code": 301
    },
    {
      "source": "/docs/v3/catch-all/integrations/n8n",
      "destination": "/docs/web-search-api/integrations/n8n",
      "type": "permanent",
      "status_code": 301
    },
    {
      "source": "/docs/v3/catch-all/integrations/make",
      "destination": "/docs/web-search-api/integrations/make",
      "type": "permanent",
      "status_code": 301
    },
    {
      "source": "/docs/v3/catch-all/integrations/langchain",
      "destination": "/docs/web-search-api/integrations/langchain",
      "type": "permanent",
      "status_code": 301
    },
    {
      "source": "/docs/v3/documentation/get-started/overview",
      "destination": "/docs/news-api/get-started/introduction",
      "type": "permanent",
      "status_code": 301
    },
    {
      "source": "/docs/v3/documentation/get-started/quickstart",
      "destination": "/docs/news-api/get-started/quickstart",
      "type": "permanent",
      "status_code": 301
    },
    {
      "source": "/docs/v3/documentation/get-started/libraries",
      "destination": "/docs/news-api/get-started/libraries",
      "type": "permanent",
      "status_code": 301
    },
    {
      "source": "/docs/v3/documentation/get-started/news-api-v3-subscription-plans",
      "destination": "/docs/news-api/get-started/subscription-plans",
      "type": "permanent",
      "status_code": 301
    },
    {
      "source": "/docs/v3/documentation/guides-and-concepts/advanced-querying",
      "destination": "/docs/news-api/guides-and-concepts/advanced-querying",
      "type": "permanent",
      "status_code": 301
    },
    {
      "source": "/docs/v3/documentation/guides-and-concepts/clustering-news-articles",
      "destination": "/docs/news-api/guides-and-concepts/clustering-news-articles",
      "type": "permanent",
      "status_code": 301
    },
    {
      "source": "/docs/v3/documentation/guides-and-concepts/articles-deduplication",
      "destination": "/docs/news-api/guides-and-concepts/articles-deduplication",
      "type": "permanent",
      "status_code": 301
    },
    {
      "source": "/docs/v3/documentation/guides-and-concepts/nlp-features",
      "destination": "/docs/news-api/guides-and-concepts/nlp-enrichments",
      "type": "permanent",
      "status_code": 301
    },
    {
      "source": "/docs/news-api/guides-and-concepts/nlp-features",
      "destination": "/docs/news-api/guides-and-concepts/nlp-enrichments",
      "type": "permanent",
      "status_code": 301
    },
    {
      "source": "/docs/v3/documentation/guides-and-concepts/custom-tags",
      "destination": "/docs/news-api/guides-and-concepts/custom-tags",
      "type": "permanent",
      "status_code": 301
    },
    {
      "source": "/docs/v3/documentation/guides-and-concepts/entity-disambiguation",
      "destination": "/docs/news-api/guides-and-concepts/entity-disambiguation",
      "type": "permanent",
      "status_code": 301
    },
    {
      "source": "/docs/v3/documentation/guides-and-concepts/breaking-news",
      "destination": "/docs/news-api/guides-and-concepts/breaking-news",
      "type": "permanent",
      "status_code": 301
    },
    {
      "source": "/docs/v3/documentation/guides-and-concepts/robots-txt-compliance",
      "destination": "/docs/news-api/guides-and-concepts/robots-txt-compliance",
      "type": "permanent",
      "status_code": 301
    },
    {
      "source": "/docs/v3/documentation/guides-and-concepts/working-with-historical-data",
      "destination": "/docs/news-api/guides-and-concepts/working-with-historical-data",
      "type": "permanent",
      "status_code": 301
    },
    {
      "source": "/docs/v3/documentation/how-to/use-boolean-operators",
      "destination": "/docs/news-api/how-to/use-boolean-operators",
      "type": "permanent",
      "status_code": 301
    },
    {